"NOMBRE","CAT_MANEJO","ESTADOS","MUNICIPIOS","REGION","SUPERFICIE","S_TERRES","S_MARINA","PRIM_DEC","ULT_DOF","PCM1","SINAP","tipo_ambie","iie_anp_count","iie_anp_mean","iie_anp_stdev","anp_id","ESTADOS_LST"
"El Pinacate y Gran Desierto de Altar","RB","Sonora","General Plutarco Elías Calles, Puerto Peñasco y San Luis Río Colorado","Noroeste y Alto Golfo de California",714556.5,714556.5,0,"1993/06/10","1993/06/10","02/07/1996","SINAP","terrestre",113888,0.918869080433986,0.150276318042719,"El Pi-RB-1993-06-10-id50","'SR'"
"Complejo Lagunar Ojo de Liebre","RB","Baja California y Baja California Sur","Baja California: Ensenada; Baja California Sur: Mulegé","Península de Baja California y Pacífico Norte",79328.97663,79328.97663,0,"1972/01/14","2000/06/07","08/08/2016","SINAP","terrestre",662,0.794464110067604,0.143156753233848,"Compl-RB-1972-01-14-id157","'BC','BS'"
"Tulum","PN","Quintana Roo","Solidaridad (Actualmente Tulum)","Península de Yucatán y Caribe Mexicano",664.3213,664.3213,0,"1981/04/23","1981/04/23",NA,NA,"terrestre",95,0.868567607323884,0.16722621945513,"Tulum-PN-1981-04-23-id471","'QR'"
"La Michilía","RB","Durango","Suchil y Mezquital","Norte y Sierra Madre Occidental",35000,35000,0,"1979/07/18","2000/06/07",NA,"SINAP","terrestre",5582,0.804741312390969,0.157507809169011,"La Mi-RB-1979-07-18-id530","'DG'"
"El Cimatario","PN","Querétaro","Querétaro, Corregidora, El Marqués y Huimilpan","Centro y Eje Neovolcánico",2447.874,2447.874,0,"1982/07/21","1982/07/21",NA,NA,"terrestre",394,0.578743271257842,0.1467169601967,"El Ci-PN-1982-07-21-id47","'QT'"
"La Sepultura","RB","Chiapas","Cintalapa, Jiquipilas, Villa Flores, Villa Corzo, Tonalá y Arriaga","Frontera Sur, Istmo y Pacífico Sur",167309.8625,167309.8625,0,"1995/06/06","1995/06/06","15/09/2000","SINAP","terrestre",26746,0.7459896113347,0.20724238471566,"La Se-RB-1995-06-06-id141","'CS'"
"Rayón","PN","Michoacán","Tlalpujahua","Occidente y Pacífico Centro",25.2107,25.2107,0,"1952/08/29","1954/05/08",NA,NA,"terrestre",4,0.417098082602024,0.0498512743521645,"Rayón-PN-1952-08-29-id99","'MN'"
"Zicuirán-Infiernillo","RB","Michoacán","Arteaga, Churumuco, La Huacana y Tumbiscatío","Occidente y Pacífico Centro",265117.7816,265117.7816,0,"2007/11/30","2007/11/30","06/11/2013","SINAP","terrestre",41157,0.655455824663365,0.148969880479413,"Zicui-RB-2007-11-30-id122","'MN'"
"Islas del Golfo de California","APFF","B.C., B.C.S., Sonora y Sinaloa","B.C.: Mexicali y Ensenada; B.C.S.: La Paz, Loreto y Mulegé; Sonora: Huatabampo, Etchojoa, B. Juárez, Cajeme, Sn. Ignacio Río Muerto, Guaymas, Hermosillo, Pitiquito, Pto. Peñasco y Caborca; Sinaloa: Rosario, Mazatlán, Elota, Culiacán y 4 mpios. más","Península de Baja California y Pacífico Norte; Noroeste y Alto Golfo de California",374553.6311,374553.6311,0,"1978/08/02","2000/06/07","17/04/2001",NA,"terrestre",0.50216735230207,0.385530507498282,0.10419501937703,"Islas-APFF-1978-08-02-id175","'BC','BS','SR','SL'"
"Bosencheve","PN","Estado de México y Michoacán","Edo. de México: Villa de Allende, Villa Victoria y San José del Rincón; Michoacán: Zitácuaro","Centro y Eje Neovolcánico",14599.61686,14599.61686,0,"1940/08/01","1940/08/01",NA,NA,"terrestre",2315,0.366537653629871,0.214181756233722,"Bosen-PN-1940-08-01-id129","'MC','MN'"
"Playa Platanitos","SANT","Nayarit","Compostela","Occidente y Pacífico Centro",79.813185,79.813185,0,"2024/01/08","2024/01/08",NA,NA,"terrestre",6,0.384200790897012,0.246019264552006,"Playa-SANT-2024-01-08-id528","'NT'"
"Sierra de Órganos","PN","Zacatecas","Sombrerete y Vicente Guerrero","Norte y Sierra Madre Occidental",1124.656176,1124.656176,0,"2000/11/27","2000/11/27","22/11/2012",NA,"terrestre",179,0.708483390301965,0.152100712157493,"Sierr-PN-2000-11-27-id105","'ZS'"
"Lago de Camécuaro","PN","Michoacán","Tangancícuaro","Occidente y Pacífico Centro",6.478593,6.478593,0,"1941/03/08","1941/03/08",NA,NA,"terrestre",1.03370257862702,0.691882533919864,0.222494317156825,"Lago -PN-1941-03-08-id469","'MN'"
"Z.P.F. en los terrenos que se encuentran en los mpios. de La Concordia, Ángel Albino Corzo, Villa Flores y Jiquipilas","APRN","Chiapas","La Concordia, Villa Flores y Villa Corzo","Frontera Sur, Istmo y Pacífico Sur",177546.1703,177546.1703,0,"1979/03/20","2007/11/27","24/04/2019",NA,"terrestre",28410,0.849092938991615,0.151638671651988,"Z.P.F-APRN-1979-03-20-id123","'CS'"
"Sacromonte","PN","Estado de México","Amecameca y Ayapango","Centro y Eje Neovolcánico",43.734227,43.734227,0,"1939/08/29","1939/08/29",NA,NA,"terrestre",5,0.15637058801949,0.130471394602158,"Sacro-PN-1939-08-29-id102","'MC'"
"Arrecifes de Xcalak","PN","Quintana Roo","Costa caribe de Othón P. Blanco","Península de Yucatán y Caribe Mexicano",17949.4562,4521.838534,13427.61767,"2000/11/27","2000/11/27","08/10/2004","SINAP","terrestre",630,0.861139968806316,0.100558020766324,"Arrec-PN-2000-11-27-id155","'QR'"
"Bahía de Loreto","PN","Baja California Sur","Frente a las costas del municipio de Loreto","Península de Baja California y Pacífico Norte",206580.75,21692.07876,184888.6712,"1996/07/19","2003/01/06","23/04/2019","SINAP","terrestre",2,0.164714705199003,0.0955441184341908,"Bahía-PN-1996-07-19-id132","'BS'"
"Peña Colorada","APRN","Queretaro","Querétaro y El Marqués","Centro y Eje Neovolcánico",4843.597312,4843.597312,0,"2023/05/08","2023/05/08",NA,NA,"terrestre",778,0.576242403823949,0.150490366184616,"Peña -APRN-2023-05-08-id472","'QT'"
"Desierto de los Leones","PN","Ciudad de México","Cuajimalpa de Morelos y Álvaro Obregón","Centro y Eje Neovolcánico",1529,1529,0,"1917/11/27","1917/11/27","05/06/2006",NA,"terrestre",244,0.7951859098966,0.0720471445188702,"Desie-PN-1917-11-27-id45","'DF'"
"Cerro de Las Campanas","PN","Querétaro","Querétaro","Centro y Eje Neovolcánico",58.493283,58.493283,0,"1937/07/07","1937/07/07",NA,NA,"terrestre",8,0.000316911768777572,0.000421937757396093,"Cerro-PN-1937-07-07-id31","'QT'"
"Sierra de San Miguelito","APFF","San Luis Potosí","Mexquitic de Carmona, San luis Potosí, Villa de Reyes y Villa de Arriaga","Noreste y Sierra Madre Oriental",111160.4428,111160.4428,0,"2021/12/13","2021/12/13",NA,NA,"terrestre",17701,0.618654980197014,0.160195292171938,"Sierr-APFF-2021-12-13-id463","'SP'"
"Tangolunda","PN","Oaxaca","Santa María Huatulco","Frontera Sur, Istmo y Pacífico Sur",110.329537,110.329537,0,"2024/02/26","2024/02/26",NA,NA,"terrestre",14,0.498248734644481,0.184342542935396,"Tango-PN-2024-02-26-id577","'OC'"
"Pico de Tancítaro","APFF","Michoacán","Tancítaro, Nuevo Parangaricutiro, Uruapan y Peribán","Occidente y Pacífico Centro",23405.92096,23405.92096,0,"1940/07/27","2009/08/19","02/04/2013",NA,"terrestre",3737,0.724466659234334,0.222284571335654,"Pico -APFF-1940-07-27-id98","'MN'"
"Uaymil","APFF","Quintana Roo","Felipe Carrillo Puerto y Bacalar","Península de Yucatán y Caribe Mexicano",89118.15355,89118.15355,0,"1994/11/17","1994/11/23","03/05/2011","SINAP","terrestre",14246,0.895813994037457,0.0520830704372535,"Uaymi-APFF-1994-11-17-id153","'QR'"
"Mariposa Monarca","RB","Michoacán y Estado de México","Michoacán: Contepec, Senguio, Angangueo, Aporo, Ocampo y Zitácuaro; Edo. de México: Temascalcingo, San José del Rincón, Villa de Allende y Donato Guerra","Centro y Eje Neovolcánico",56259.05073,56259.05073,0,"2000/11/10","2009/11/03","30/04/2001","SINAP","terrestre",8698,0.731733988515651,0.238933882801379,"Marip-RB-2000-11-10-id127","'MN','MC'"
"El Tepozteco","PN","Morelos y Ciudad de México","Morelos: Cuernavaca, Tepoztlán, Huitzilac, Yautepec y Tlalnepantla; Ciudad de México: Milpa Alta","Centro y Eje Neovolcánico",23258.7,23258.7,0,"1937/01/22","1937/01/22","09/05/2011",NA,"terrestre",3720,0.573788569447207,0.225951771579443,"El Te-PN-1937-01-22-id53","'MS','DF'"
"Ocampo","APFF","Coahuila y Chihuahua","Coahuila: Ocampo; Chihuahua: Manuel Benavides","Noreste y Sierra Madre Oriental",344238.2333,344238.2333,0,"2009/06/05","2009/06/05","05/06/2015","SINAP","terrestre",54798,0.94090358610519,0.0849012951537049,"Ocamp-APFF-2009-06-05-id93","'CL','CH'"
"Cerro Mohinora","APFF","Chihuahua","Guadalupe y Calvo","Norte y Sierra Madre Occidental",9126.356869,9126.356869,0,"2015/07/10","2015/07/10","22/05/2017",NA,"terrestre",1455,0.874913279932389,0.205862384378482,"Cerro-APFF-2015-07-10-id160","'CH'"
"Playa Piedra de Tlacoyunque","SANT","Guerrero","Tecpan de Galeana","Occidente y Pacífico Centro",98.014236,98.014236,0,"1986/10/29","2022/12/24",NA,NA,"terrestre",14,0.306029916874,0.223126109417195,"Playa-SANT-1986-10-29-id555","'GR'"
"Benito Juárez","PN","Oaxaca","Oaxaca de Juárez, San Andrés Huayapam y Tlalixtac de Cabrera","Frontera Sur, Istmo y Pacífico Sur",2591.515659,2591.515659,0,"1937/12/30","1937/12/30","27/12/2013",NA,"terrestre",414,0.696813756501041,0.0800385480376312,"Benit-PN-1937-12-30-id15","'OC'"
"Sierra de San Pedro Mártir","PN","Baja California","Ensenada","Península de Baja California y Pacífico Norte",72910.68,72910.68,0,"1947/04/26","1947/04/26","15/12/2009","SINAP","terrestre",11635,0.914979083509175,0.124796320423062,"Sierr-PN-1947-04-26-id106","'BC'"
